{
  "councilName": "Penworth County Council",
  "councilMetadata": {
    "tier": "county",
    "financialDistress": false
  },
  "nodes": [
    { "id": "pcc-fn-adults", "label": "Adult Social Care", "type": "Function", "lgaFunctionId": "148" },
    { "id": "pcc-fn-childrens", "label": "Children's Services", "type": "Function", "lgaFunctionId": "152" },
    { "id": "pcc-fn-highways", "label": "Highways Management", "type": "Function", "lgaFunctionId": "109" },
    { "id": "pcc-fn-libraries", "label": "Libraries", "type": "Function", "lgaFunctionId": "76" },
    { "id": "pcc-fn-finance", "label": "Finance and Accounting", "type": "Function", "lgaFunctionId": "116" },
    { "id": "pcc-fn-hr", "label": "Human Resources", "type": "Function", "lgaFunctionId": "119" },
    { "id": "pcc-fn-crm", "label": "Customer Relationship Management", "type": "Function", "lgaFunctionId": "43" },
    { "id": "pcc-fn-publichealth", "label": "Public Health", "type": "Function", "lgaFunctionId": "65" },
    {
      "id": "pcc-sys-liquidlogic-las",
      "label": "Liquidlogic LAS Adult Social Care",
      "type": "ITSystem",
      "owner": "Penworth County Council",
      "users": 3500,
      "vendor": "System C",
      "cost": "£980k/yr",
      "annualCost": 980000,
      "endYear": 2028,
      "endMonth": 3,
      "noticePeriod": 12,
      "portability": "Medium",
      "dataPartitioning": "Segmented",
      "isCloud": true,
      "isERP": false,
      "targetAuthorities": ["Penworth North Council", "Penworth South Council"]
    },
    {
      "id": "pcc-sys-liquidlogic-ehm",
      "label": "Liquidlogic EHM Children's Services",
      "type": "ITSystem",
      "owner": "Penworth County Council",
      "users": 2700,
      "vendor": "System C",
      "cost": "£780k/yr",
      "annualCost": 780000,
      "endYear": 2028,
      "endMonth": 9,
      "noticePeriod": 12,
      "portability": "Medium",
      "dataPartitioning": "Segmented",
      "isCloud": true,
      "isERP": false,
      "targetAuthorities": ["Penworth North Council", "Penworth South Council"]
    },
    {
      "id": "pcc-sys-confirm",
      "label": "Confirm Highways Management",
      "type": "ITSystem",
      "owner": "Penworth County Council",
      "users": 400,
      "vendor": "Brightly",
      "cost": "£235k/yr",
      "annualCost": 235000,
      "endYear": 2029,
      "endMonth": 6,
      "noticePeriod": 6,
      "portability": "High",
      "dataPartitioning": "Segmented",
      "isCloud": true,
      "isERP": false,
      "targetAuthorities": ["Penworth North Council", "Penworth South Council"]
    },
    {
      "id": "pcc-sys-koha",
      "label": "Koha Library Management System",
      "type": "ITSystem",
      "owner": "Penworth County Council",
      "users": 150,
      "vendor": "In-House",
      "cost": "£55k/yr",
      "annualCost": 55000,
      "endYear": 2027,
      "endMonth": 3,
      "noticePeriod": 3,
      "portability": "High",
      "dataPartitioning": "Segmented",
      "isCloud": false,
      "isERP": false,
      "targetAuthorities": ["Penworth North Council"]
    },
    {
      "id": "pcc-sys-oracle-erp",
      "label": "Oracle Fusion ERP",
      "type": "ITSystem",
      "owner": "Penworth County Council",
      "users": 5000,
      "vendor": "Oracle",
      "cost": "£1.8m/yr",
      "annualCost": 1800000,
      "endYear": 2031,
      "endMonth": 3,
      "noticePeriod": 18,
      "portability": "Low",
      "dataPartitioning": "Monolithic",
      "isCloud": false,
      "isERP": true,
      "capabilityType": ["payments", "workflow"],
      "targetAuthorities": ["Penworth North Council", "Penworth South Council"]
    },
    {
      "id": "pcc-sys-salesforce",
      "label": "Salesforce Government Cloud CRM",
      "type": "ITSystem",
      "owner": "Penworth County Council",
      "users": 900,
      "vendor": "Salesforce",
      "cost": "£380k/yr",
      "annualCost": 380000,
      "endYear": 2029,
      "endMonth": 9,
      "noticePeriod": 6,
      "portability": "High",
      "dataPartitioning": "Segmented",
      "isCloud": true,
      "isERP": false,
      "targetAuthorities": ["Penworth North Council", "Penworth South Council"]
    },
    {
      "id": "pcc-sys-publichealth",
      "label": "Public Health Intelligence Platform",
      "type": "ITSystem",
      "owner": "Penworth County Council",
      "users": 100,
      "vendor": "In-House",
      "cost": "£40k/yr",
      "annualCost": 40000,
      "endYear": 2026,
      "endMonth": 9,
      "noticePeriod": 3,
      "portability": "High",
      "dataPartitioning": "Segmented",
      "isCloud": false,
      "isERP": false,
      "targetAuthorities": ["Penworth South Council"]
    },
    {
      "id": "pcc-sys-govuk-notify",
      "label": "GOV.UK Notify",
      "type": "ITSystem",
      "owner": "Penworth County Council",
      "users": 600,
      "vendor": "GDS",
      "cost": "£15k/yr",
      "annualCost": 15000,
      "endYear": 2030,
      "endMonth": 12,
      "noticePeriod": 1,
      "portability": "High",
      "dataPartitioning": "Segmented",
      "isCloud": true,
      "isERP": false,
      "capabilityType": ["sms", "email"],
      "targetAuthorities": ["Penworth North Council", "Penworth South Council"]
    }
  ],
  "edges": [
    { "source": "pcc-sys-liquidlogic-las", "target": "pcc-fn-adults", "relationship": "REALIZES" },
    { "source": "pcc-sys-liquidlogic-ehm", "target": "pcc-fn-childrens", "relationship": "REALIZES" },
    { "source": "pcc-sys-confirm", "target": "pcc-fn-highways", "relationship": "REALIZES" },
    { "source": "pcc-sys-koha", "target": "pcc-fn-libraries", "relationship": "REALIZES" },
    { "source": "pcc-sys-oracle-erp", "target": "pcc-fn-finance", "relationship": "REALIZES" },
    { "source": "pcc-sys-oracle-erp", "target": "pcc-fn-hr", "relationship": "REALIZES" },
    { "source": "pcc-sys-salesforce", "target": "pcc-fn-crm", "relationship": "REALIZES" },
    { "source": "pcc-sys-publichealth", "target": "pcc-fn-publichealth", "relationship": "REALIZES" },
    { "source": "pcc-sys-liquidlogic-las", "target": "pcc-sys-oracle-erp", "relationship": "CONSUMES_CAPABILITY", "capabilities": ["payments"] },
    { "source": "pcc-sys-liquidlogic-ehm", "target": "pcc-sys-oracle-erp", "relationship": "CONSUMES_CAPABILITY", "capabilities": ["payments"] },
    { "source": "pcc-sys-confirm", "target": "pcc-sys-oracle-erp", "relationship": "CONSUMES_CAPABILITY", "capabilities": ["payments"] },
    { "source": "pcc-sys-salesforce", "target": "pcc-sys-govuk-notify", "relationship": "CONSUMES_CAPABILITY", "capabilities": ["sms", "email"] },
    { "source": "pcc-sys-liquidlogic-las", "target": "pcc-sys-govuk-notify", "relationship": "CONSUMES_CAPABILITY", "capabilities": ["sms"] }
  ]
}
