{
  "councilName": "Crestfield District Council",
  "councilMetadata": {
    "tier": "district",
    "financialDistress": false
  },
  "nodes": [
    { "id": "cdc-fn-waste", "label": "Household Waste Collection", "type": "Function", "lgaFunctionId": "142" },
    { "id": "cdc-fn-benefits", "label": "Housing Benefits", "type": "Function", "lgaFunctionId": "3" },
    { "id": "cdc-fn-planning", "label": "Planning Applications", "type": "Function", "lgaFunctionId": "101" },
    { "id": "cdc-fn-envhealth", "label": "Environmental Health", "type": "Function", "lgaFunctionId": "34" },
    { "id": "cdc-fn-elections", "label": "Electoral Registration", "type": "Function", "lgaFunctionId": "146" },
    { "id": "cdc-fn-finance", "label": "Finance and Accounting", "type": "Function", "lgaFunctionId": "116" },
    { "id": "cdc-fn-hr", "label": "Human Resources", "type": "Function", "lgaFunctionId": "119" },
    {
      "id": "cdc-sys-whitespace",
      "label": "Whitespace Waste",
      "type": "ITSystem",
      "owner": "Crestfield District Council",
      "users": 38,
      "vendor": "Whitespace",
      "cost": "£80k/yr",
      "annualCost": 80000,
      "endYear": 2027,
      "endMonth": 6,
      "noticePeriod": 6,
      "portability": "High",
      "dataPartitioning": "Segmented",
      "isCloud": true,
      "isERP": false
    },
    {
      "id": "cdc-sys-nec",
      "label": "NEC Revenues and Benefits",
      "type": "ITSystem",
      "owner": "Crestfield District Council",
      "users": 42,
      "vendor": "NEC",
      "cost": "£145k/yr",
      "annualCost": 145000,
      "endYear": 2028,
      "endMonth": 3,
      "noticePeriod": 9,
      "portability": "Medium",
      "dataPartitioning": "Segmented",
      "isCloud": false,
      "isERP": false
    },
    {
      "id": "cdc-sys-arcus",
      "label": "Arcus Global Planning Portal",
      "type": "ITSystem",
      "owner": "Crestfield District Council",
      "users": 48,
      "vendor": "Arcus Global",
      "cost": "£75k/yr",
      "annualCost": 75000,
      "endYear": 2029,
      "endMonth": 3,
      "noticePeriod": 3,
      "portability": "High",
      "dataPartitioning": "Segmented",
      "isCloud": true,
      "isERP": false
    },
    {
      "id": "cdc-sys-jadu",
      "label": "Jadu EH Case Management",
      "type": "ITSystem",
      "owner": "Crestfield District Council",
      "users": 24,
      "vendor": "Jadu",
      "cost": "£45k/yr",
      "annualCost": 45000,
      "endYear": 2028,
      "endMonth": 9,
      "noticePeriod": 3,
      "portability": "High",
      "dataPartitioning": "Segmented",
      "isCloud": true,
      "isERP": false
    },
    {
      "id": "cdc-sys-demo",
      "label": "Xpress Electoral Management",
      "type": "ITSystem",
      "owner": "Crestfield District Council",
      "users": 10,
      "vendor": "Access Group",
      "cost": "£30k/yr",
      "annualCost": 30000,
      "endYear": 2027,
      "endMonth": 3,
      "noticePeriod": 3,
      "portability": "High",
      "dataPartitioning": "Segmented",
      "isCloud": true,
      "isERP": false
    },
    {
      "id": "cdc-sys-access-finance",
      "label": "Access Financials",
      "type": "ITSystem",
      "owner": "Crestfield District Council",
      "users": 20,
      "vendor": "Access Group",
      "cost": "£55k/yr",
      "annualCost": 55000,
      "endYear": 2028,
      "endMonth": 6,
      "noticePeriod": 3,
      "portability": "High",
      "dataPartitioning": "Segmented",
      "isCloud": true,
      "isERP": false
    },
    {
      "id": "cdc-sys-workday",
      "label": "Workday HR",
      "type": "ITSystem",
      "owner": "Crestfield District Council",
      "users": 15,
      "vendor": "Workday",
      "cost": "£65k/yr",
      "annualCost": 65000,
      "endYear": 2029,
      "endMonth": 9,
      "noticePeriod": 6,
      "portability": "High",
      "dataPartitioning": "Segmented",
      "isCloud": true,
      "isERP": false
    },
    {
      "id": "cdc-sys-govuk-notify",
      "label": "GOV.UK Notify",
      "type": "ITSystem",
      "owner": "Crestfield District Council",
      "users": 150,
      "vendor": "GDS",
      "cost": "£5k/yr",
      "annualCost": 5000,
      "endYear": 2030,
      "endMonth": 3,
      "noticePeriod": 1,
      "portability": "High",
      "dataPartitioning": "Segmented",
      "isCloud": true,
      "isERP": false,
      "capabilityType": ["sms", "email"]
    }
  ],
  "edges": [
    { "source": "cdc-sys-whitespace", "target": "cdc-fn-waste", "relationship": "REALIZES" },
    { "source": "cdc-sys-nec", "target": "cdc-fn-benefits", "relationship": "REALIZES" },
    { "source": "cdc-sys-arcus", "target": "cdc-fn-planning", "relationship": "REALIZES" },
    { "source": "cdc-sys-jadu", "target": "cdc-fn-envhealth", "relationship": "REALIZES" },
    { "source": "cdc-sys-demo", "target": "cdc-fn-elections", "relationship": "REALIZES" },
    { "source": "cdc-sys-access-finance", "target": "cdc-fn-finance", "relationship": "REALIZES" },
    { "source": "cdc-sys-workday", "target": "cdc-fn-hr", "relationship": "REALIZES" },
    { "source": "cdc-sys-whitespace", "target": "cdc-sys-govuk-notify", "relationship": "CONSUMES_CAPABILITY", "capabilities": ["sms"] },
    { "source": "cdc-sys-arcus", "target": "cdc-sys-govuk-notify", "relationship": "CONSUMES_CAPABILITY", "capabilities": ["email"] },
    { "source": "cdc-sys-jadu", "target": "cdc-sys-govuk-notify", "relationship": "CONSUMES_CAPABILITY", "capabilities": ["email"] }
  ]
}
