{
  "councilName": "Westampton District",
  "councilMetadata": {
    "tier": "district"
  },
  "nodes": [
    { "id": "LGA_WASTE", "label": "Waste Collection", "type": "Function", "lgaFunctionId": "142" },
    { "id": "LGA_REVS", "label": "Council Tax & Benefits", "type": "Function", "lgaFunctionId": "3" },
    { "id": "LGA_PLAN", "label": "Planning Control", "type": "Function", "lgaFunctionId": "101" },
    { "id": "LGA_HOUSE", "label": "Housing Management", "type": "Function", "lgaFunctionId": "159" },
    { "id": "LGA_ENV", "label": "Environmental Health", "type": "Function", "lgaFunctionId": "34" },
    { "id": "LGA_ELEC", "label": "Electoral Services", "type": "Function", "lgaFunctionId": "146" },
    { "id": "LGA_FIN", "label": "Corporate Finance", "type": "Function", "lgaFunctionId": "116" },
    { "id": "LGA_HR", "label": "HR & Payroll", "type": "Function", "lgaFunctionId": "119" },
    { "id": "LGA_CRM", "label": "Customer Services", "type": "Function", "lgaFunctionId": "43" },

    {
      "_note": "Modular HR/Finance stack. Collides with the massive Oracle monolith at the county.",
      "id": "sys_w_fin", "label": "Xero Corporate", "type": "ITSystem", "owner": "Westampton District", "vendor": "Xero", "users": 150, "endYear": 2026, "endMonth": 3, "noticePeriod": 3, "cost": "£80k/yr", "annualCost": 80000, "portability": "High", "dataPartitioning": "Segmented", "isCloud": true, "isERP": false, "capabilityType": ["payments"]
    },
    { "id": "sys_w_hr", "label": "Workday HR", "type": "ITSystem", "owner": "Westampton District", "vendor": "Workday", "users": 200, "endYear": 2026, "endMonth": 6, "noticePeriod": 6, "cost": "£180k/yr", "annualCost": 180000, "portability": "High", "dataPartitioning": "Segmented", "isCloud": true, "isERP": false },
    { "id": "sys_w_waste", "label": "Bartec Collective", "type": "ITSystem", "owner": "Westampton District", "vendor": "Bartec", "users": 120, "endYear": 2025, "endMonth": 11, "noticePeriod": 3, "cost": "£140k/yr", "annualCost": 140000, "portability": "High", "dataPartitioning": "Segmented", "isCloud": true, "isERP": false },
    { "id": "sys_w_revs", "label": "Civica Revenues SaaS", "type": "ITSystem", "owner": "Westampton District", "vendor": "Civica", "users": 80, "endYear": 2027, "endMonth": 8, "noticePeriod": 6, "cost": "£210k/yr", "annualCost": 210000, "portability": "High", "dataPartitioning": "Segmented", "isCloud": true, "isERP": false },
    { "id": "sys_w_plan", "label": "Idox Uniform Cloud", "type": "ITSystem", "owner": "Westampton District", "vendor": "Idox", "users": 45, "endYear": 2026, "endMonth": 2, "noticePeriod": 6, "cost": "£90k/yr", "annualCost": 90000, "portability": "Medium", "dataPartitioning": "Segmented", "isCloud": true, "isERP": false },
    { "id": "sys_w_house", "label": "Capita One Housing", "type": "ITSystem", "owner": "Westampton District", "vendor": "Capita", "users": 95, "endYear": 2028, "endMonth": 4, "noticePeriod": 12, "cost": "£160k/yr", "annualCost": 160000, "portability": "Medium", "dataPartitioning": "Segmented", "isCloud": true, "isERP": false },
    { "id": "sys_w_env", "label": "Tascomi Public Protection", "type": "ITSystem", "owner": "Westampton District", "vendor": "Idox", "users": 60, "endYear": 2027, "endMonth": 9, "noticePeriod": 6, "cost": "£75k/yr", "annualCost": 75000, "portability": "High", "dataPartitioning": "Segmented", "isCloud": true, "isERP": false },
    { "id": "sys_w_elec", "label": "Xpress Register", "type": "ITSystem", "owner": "Westampton District", "vendor": "Civica", "users": 15, "endYear": 2025, "endMonth": 8, "noticePeriod": 3, "cost": "£40k/yr", "annualCost": 40000, "portability": "Medium", "dataPartitioning": "Segmented", "isCloud": true, "isERP": false },
    { "id": "sys_w_crm", "label": "Jadu CXM", "type": "ITSystem", "owner": "Westampton District", "vendor": "Jadu", "users": 350, "endYear": 2026, "endMonth": 1, "noticePeriod": 3, "cost": "£120k/yr", "annualCost": 120000, "portability": "High", "dataPartitioning": "Segmented", "isCloud": true, "isERP": false, "capabilityType": ["forms"] },
    {
      "_note": "District payment gateway for online council tax and parking payments.",
      "id": "sys_w_stripe", "label": "Stripe", "type": "ITSystem", "owner": "Westampton District", "vendor": "Stripe", "users": 80, "endYear": 2027, "endMonth": 12, "noticePeriod": 1, "cost": "£15k/yr", "annualCost": 15000, "portability": "High", "dataPartitioning": "Segmented", "isCloud": true, "isERP": false, "capabilityType": ["payments"]
    },
    {
      "_note": "Notification platform for customer-facing alerts and reminders.",
      "id": "sys_w_notify", "label": "GOV.UK Notify", "type": "ITSystem", "owner": "Westampton District", "vendor": "GDS", "users": 150, "endYear": 2030, "endMonth": 12, "noticePeriod": 1, "cost": "£5k/yr", "annualCost": 5000, "portability": "High", "dataPartitioning": "Segmented", "isCloud": true, "isERP": false, "capabilityType": ["sms", "email"]
    }
  ],
  "edges": [
    { "source": "sys_w_waste", "target": "LGA_WASTE", "relationship": "REALIZES" },
    { "source": "sys_w_revs", "target": "LGA_REVS", "relationship": "REALIZES" },
    { "source": "sys_w_plan", "target": "LGA_PLAN", "relationship": "REALIZES" },
    { "source": "sys_w_house", "target": "LGA_HOUSE", "relationship": "REALIZES" },
    { "source": "sys_w_env", "target": "LGA_ENV", "relationship": "REALIZES" },
    { "source": "sys_w_elec", "target": "LGA_ELEC", "relationship": "REALIZES" },
    { "source": "sys_w_fin", "target": "LGA_FIN", "relationship": "REALIZES" },
    { "source": "sys_w_hr", "target": "LGA_HR", "relationship": "REALIZES" },
    { "source": "sys_w_crm", "target": "LGA_CRM", "relationship": "REALIZES" },

    { "source": "sys_w_crm", "target": "sys_w_notify", "relationship": "CONSUMES_CAPABILITY", "capabilities": ["sms", "email"] },
    { "source": "sys_w_crm", "target": "sys_w_stripe", "relationship": "CONSUMES_CAPABILITY", "capabilities": ["payments"] },
    { "source": "sys_w_revs", "target": "sys_w_stripe", "relationship": "CONSUMES_CAPABILITY", "capabilities": ["payments"] },
    { "source": "sys_w_waste", "target": "sys_w_notify", "relationship": "CONSUMES_CAPABILITY", "capabilities": ["sms"] },
    { "source": "sys_w_house", "target": "sys_w_notify", "relationship": "CONSUMES_CAPABILITY", "capabilities": ["email"] }
  ]
}
