{
  "councilName": "Easton District",
  "councilMetadata": {
    "tier": "district",
    "financialDistress": true
  },
  "nodes": [
    {
      "id": "LGA_WASTE",
      "label": "Refuse Operations",
      "type": "Function",
      "lgaFunctionId": "142"
    },
    {
      "id": "LGA_REVS",
      "label": "Revenues & Benefits",
      "type": "Function",
      "lgaFunctionId": "3"
    },
    {
      "id": "LGA_PLAN",
      "label": "Planning",
      "type": "Function",
      "lgaFunctionId": "101"
    },
    {
      "id": "LGA_HOUSE",
      "label": "Tenancy Services",
      "type": "Function",
      "lgaFunctionId": "159"
    },
    {
      "id": "LGA_ENV",
      "label": "Environmental Health",
      "type": "Function",
      "lgaFunctionId": "34"
    },
    {
      "id": "LGA_ELEC",
      "label": "Elections",
      "type": "Function",
      "lgaFunctionId": "146"
    },
    {
      "id": "LGA_FIN",
      "label": "Corporate Finance",
      "type": "Function",
      "lgaFunctionId": "116"
    },
    {
      "id": "LGA_HR",
      "label": "HR & Payroll",
      "type": "Function",
      "lgaFunctionId": "119"
    },
    {
      "id": "LGA_CRM",
      "label": "Customer Contact",
      "type": "Function",
      "lgaFunctionId": "43"
    },
    {
      "_note": "District-level monolith. Creates a secondary entanglement trap against the County Oracle system.",
      "id": "sys_e_erp",
      "label": "Unit4 Business World",
      "type": "ITSystem",
      "owner": "Easton District",
      "vendor": "Unit4",
      "users": 850,
      "endYear": 2028,
      "endMonth": 4,
      "noticePeriod": 12,
      "cost": "\u00a3450k/yr",
      "annualCost": 450000,
      "portability": "Low",
      "dataPartitioning": "Monolithic",
      "isERP": true,
      "capabilityType": [
        "payments",
        "workflow"
      ],
      "hosting": "on-premise"
    },
    {
      "_note": "Shared service with Southby. Exact same NEC vendor and expiry.",
      "id": "sys_shared_revs",
      "label": "NEC Revenues (Shared)",
      "type": "ITSystem",
      "owner": "Easton District",
      "vendor": "NEC",
      "users": 65,
      "endYear": 2029,
      "endMonth": 4,
      "noticePeriod": 12,
      "cost": "\u00a3150k/yr",
      "annualCost": 150000,
      "sharedWith": [
        "Southby Borough"
      ],
      "portability": "Low",
      "dataPartitioning": "Monolithic",
      "isERP": false,
      "hosting": "on-premise"
    },
    {
      "id": "sys_e_waste",
      "label": "Local SQL Routing",
      "type": "ITSystem",
      "owner": "Easton District",
      "vendor": "In-House",
      "supportModel": "unsupported",
      "users": 30,
      "endYear": 2025,
      "endMonth": 11,
      "noticePeriod": 1,
      "cost": "\u00a330k/yr",
      "annualCost": 30000,
      "portability": "High",
      "dataPartitioning": "Monolithic",
      "isERP": false,
      "hosting": "on-premise"
    },
    {
      "id": "sys_e_plan",
      "label": "Agile Planning",
      "type": "ITSystem",
      "owner": "Easton District",
      "vendor": "AgileApps",
      "users": 35,
      "endYear": 2026,
      "endMonth": 12,
      "noticePeriod": 3,
      "cost": "\u00a385k/yr",
      "annualCost": 85000,
      "portability": "High",
      "dataPartitioning": "Segmented",
      "isERP": false,
      "hosting": "cloud"
    },
    {
      "id": "sys_e_house",
      "label": "NEC Housing",
      "type": "ITSystem",
      "owner": "Easton District",
      "vendor": "NEC",
      "users": 105,
      "endYear": 2027,
      "endMonth": 1,
      "noticePeriod": 6,
      "cost": "\u00a3190k/yr",
      "annualCost": 190000,
      "portability": "Low",
      "dataPartitioning": "Monolithic",
      "isERP": false,
      "hosting": "on-premise"
    },
    {
      "id": "sys_e_env",
      "label": "Idox Public Protection",
      "type": "ITSystem",
      "owner": "Easton District",
      "vendor": "Idox",
      "users": 40,
      "endYear": 2025,
      "endMonth": 6,
      "noticePeriod": 3,
      "cost": "\u00a360k/yr",
      "annualCost": 60000,
      "portability": "Medium",
      "dataPartitioning": "Segmented",
      "isERP": false,
      "hosting": "on-premise"
    },
    {
      "id": "sys_e_elec",
      "label": "Xpress Register",
      "type": "ITSystem",
      "owner": "Easton District",
      "vendor": "Civica",
      "users": 12,
      "endYear": 2028,
      "endMonth": 2,
      "noticePeriod": 6,
      "cost": "\u00a335k/yr",
      "annualCost": 35000,
      "portability": "Medium",
      "dataPartitioning": "Segmented",
      "isERP": false,
      "hosting": "on-premise"
    },
    {
      "id": "sys_e_crm",
      "label": "GOSS iCM",
      "type": "ITSystem",
      "owner": "Easton District",
      "vendor": "GOSS Interactive",
      "users": 200,
      "endYear": 2026,
      "endMonth": 5,
      "noticePeriod": 3,
      "cost": "\u00a390k/yr",
      "annualCost": 90000,
      "portability": "High",
      "dataPartitioning": "Segmented",
      "isERP": false,
      "hosting": "cloud"
    },
    {
      "_note": "District payment gateway for council tax and parking payments.",
      "id": "sys_e_pay360",
      "label": "Capita Pay360",
      "type": "ITSystem",
      "owner": "Easton District",
      "vendor": "Capita",
      "users": 80,
      "endYear": 2027,
      "endMonth": 9,
      "noticePeriod": 3,
      "cost": "\u00a320k/yr",
      "annualCost": 20000,
      "portability": "High",
      "dataPartitioning": "Segmented",
      "isERP": false,
      "capabilityType": [
        "payments"
      ],
      "hosting": "cloud"
    },
    {
      "_note": "Notification platform for customer-facing alerts and reminders.",
      "id": "sys_e_notify",
      "label": "GOV.UK Notify",
      "type": "ITSystem",
      "owner": "Easton District",
      "vendor": "GDS",
      "users": 150,
      "endYear": 2030,
      "endMonth": 12,
      "noticePeriod": 1,
      "cost": "\u00a35k/yr",
      "annualCost": 5000,
      "portability": "High",
      "dataPartitioning": "Segmented",
      "isERP": false,
      "capabilityType": [
        "sms",
        "email"
      ],
      "hosting": "cloud"
    }
  ],
  "edges": [
    {
      "source": "sys_e_waste",
      "target": "LGA_WASTE",
      "relationship": "REALIZES"
    },
    {
      "source": "sys_shared_revs",
      "target": "LGA_REVS",
      "relationship": "REALIZES"
    },
    {
      "source": "sys_e_plan",
      "target": "LGA_PLAN",
      "relationship": "REALIZES"
    },
    {
      "source": "sys_e_house",
      "target": "LGA_HOUSE",
      "relationship": "REALIZES"
    },
    {
      "source": "sys_e_env",
      "target": "LGA_ENV",
      "relationship": "REALIZES"
    },
    {
      "source": "sys_e_elec",
      "target": "LGA_ELEC",
      "relationship": "REALIZES"
    },
    {
      "source": "sys_e_erp",
      "target": "LGA_FIN",
      "relationship": "REALIZES"
    },
    {
      "source": "sys_e_erp",
      "target": "LGA_HR",
      "relationship": "REALIZES"
    },
    {
      "source": "sys_e_crm",
      "target": "LGA_CRM",
      "relationship": "REALIZES"
    },
    {
      "source": "sys_shared_revs",
      "target": "sys_e_pay360",
      "relationship": "CONSUMES_CAPABILITY",
      "capabilities": [
        "payments"
      ]
    },
    {
      "source": "sys_e_crm",
      "target": "sys_e_notify",
      "relationship": "CONSUMES_CAPABILITY",
      "capabilities": [
        "sms",
        "email"
      ]
    },
    {
      "source": "sys_e_house",
      "target": "sys_e_notify",
      "relationship": "CONSUMES_CAPABILITY",
      "capabilities": [
        "email"
      ]
    },
    {
      "source": "sys_e_crm",
      "target": "sys_e_pay360",
      "relationship": "CONSUMES_CAPABILITY",
      "capabilities": [
        "payments"
      ]
    }
  ]
}