{
  "councilName": "Birchwood District Council",
  "councilMetadata": {
    "tier": "district",
    "financialDistress": true
  },
  "nodes": [
    {
      "id": "bwdc-fn-waste",
      "label": "Waste",
      "type": "Function",
      "lgaFunctionId": "142"
    },
    {
      "id": "bwdc-fn-benefits",
      "label": "Benefits",
      "type": "Function",
      "lgaFunctionId": "3"
    },
    {
      "id": "bwdc-fn-planning",
      "label": "Planning",
      "type": "Function",
      "lgaFunctionId": "101"
    },
    {
      "id": "bwdc-fn-housing",
      "label": "Housing",
      "type": "Function",
      "lgaFunctionId": "159"
    },
    {
      "id": "bwdc-fn-envhealth",
      "label": "Environmental Health",
      "type": "Function",
      "lgaFunctionId": "34"
    },
    {
      "id": "bwdc-fn-finance",
      "label": "Finance",
      "type": "Function",
      "lgaFunctionId": "116"
    },
    {
      "id": "bwdc-fn-hr",
      "label": "Human Resources",
      "type": "Function",
      "lgaFunctionId": "119"
    },
    {
      "id": "bwdc-fn-crm",
      "label": "Customer Services",
      "type": "Function",
      "lgaFunctionId": "43"
    },
    {
      "id": "bwdc-sys-capita-waste",
      "label": "Capita Waste Operations",
      "type": "ITSystem",
      "owner": "Birchwood District Council",
      "users": 25,
      "vendor": "Capita",
      "supportModel": "vendor-supported",
      "cost": "\u00a335k/yr",
      "annualCost": 35000,
      "endYear": 2025,
      "endMonth": 6,
      "noticePeriod": 3,
      "portability": "Low",
      "dataPartitioning": "Monolithic",
      "isERP": false,
      "hosting": "on-premise"
    },
    {
      "id": "bwdc-sys-nec-revs",
      "label": "NEC Revenues (Shared)",
      "type": "ITSystem",
      "owner": "Birchwood District Council",
      "users": 45,
      "vendor": "NEC",
      "supportModel": "vendor-supported",
      "cost": "\u00a395k/yr",
      "annualCost": 95000,
      "endYear": 2025,
      "endMonth": 9,
      "noticePeriod": 6,
      "portability": "Low",
      "dataPartitioning": "Monolithic",
      "isERP": false,
      "sharedWith": [
        "Ashford Borough Council"
      ],
      "version": "NEC iWorld 2019",
      "notes": "Shared with Ferndale. Neither council holds the contract \u2014 managed by legacy shared services company being wound down.",
      "hosting": "on-premise"
    },
    {
      "id": "bwdc-sys-capita-plan",
      "label": "Capita Planning",
      "type": "ITSystem",
      "owner": "Birchwood District Council",
      "users": 18,
      "vendor": "Capita",
      "supportModel": "vendor-supported",
      "cost": "\u00a340k/yr",
      "annualCost": 40000,
      "endYear": 2025,
      "endMonth": 4,
      "noticePeriod": 3,
      "portability": "Low",
      "dataPartitioning": "Monolithic",
      "isERP": false,
      "hosting": "on-premise"
    },
    {
      "id": "bwdc-sys-capita-housing",
      "label": "Capita Housing",
      "type": "ITSystem",
      "owner": "Birchwood District Council",
      "users": 35,
      "vendor": "Capita",
      "supportModel": "vendor-supported",
      "cost": "\u00a360k/yr",
      "annualCost": 60000,
      "endYear": 2025,
      "endMonth": 8,
      "noticePeriod": 6,
      "portability": "Low",
      "dataPartitioning": "Monolithic",
      "isERP": false,
      "hosting": "on-premise"
    },
    {
      "id": "bwdc-sys-nec-eh",
      "label": "NEC Environmental Health",
      "type": "ITSystem",
      "owner": "Birchwood District Council",
      "users": 15,
      "vendor": "NEC",
      "supportModel": "vendor-supported",
      "cost": "\u00a325k/yr",
      "annualCost": 25000,
      "endYear": 2025,
      "endMonth": 11,
      "noticePeriod": 3,
      "portability": "Low",
      "dataPartitioning": "Monolithic",
      "isERP": false,
      "hosting": "on-premise"
    },
    {
      "id": "bwdc-sys-capita-fin",
      "label": "Capita Financial Management",
      "type": "ITSystem",
      "owner": "Birchwood District Council",
      "users": 40,
      "vendor": "Capita",
      "supportModel": "vendor-supported",
      "cost": "\u00a375k/yr",
      "annualCost": 75000,
      "endYear": 2025,
      "endMonth": 7,
      "noticePeriod": 6,
      "portability": "Low",
      "dataPartitioning": "Monolithic",
      "isERP": false,
      "hosting": "on-premise"
    },
    {
      "id": "bwdc-sys-nec-hr",
      "label": "NEC Personnel",
      "type": "ITSystem",
      "owner": "Birchwood District Council",
      "users": 55,
      "vendor": "NEC",
      "supportModel": "vendor-supported",
      "cost": "\u00a385k/yr",
      "annualCost": 85000,
      "endYear": 2025,
      "endMonth": 10,
      "noticePeriod": 6,
      "portability": "Low",
      "dataPartitioning": "Monolithic",
      "isERP": false,
      "hosting": "on-premise"
    },
    {
      "id": "bwdc-sys-inhouse-crm",
      "label": "In-House Web Forms",
      "type": "ITSystem",
      "owner": "Birchwood District Council",
      "users": 30,
      "vendor": "In-House",
      "supportModel": "unsupported",
      "cost": "\u00a315k/yr",
      "annualCost": 15000,
      "endYear": 2025,
      "endMonth": 5,
      "noticePeriod": 1,
      "portability": "Low",
      "dataPartitioning": "Monolithic",
      "isERP": false,
      "capabilityType": [
        "forms"
      ],
      "hosting": "on-premise"
    },
    {
      "id": "bwdc-sys-govuk-notify",
      "label": "GOV.UK Notify",
      "type": "ITSystem",
      "owner": "Birchwood District Council",
      "users": 100,
      "vendor": "GDS",
      "supportModel": "vendor-supported",
      "cost": "\u00a35k/yr",
      "annualCost": 5000,
      "endYear": 2030,
      "endMonth": 12,
      "noticePeriod": 1,
      "portability": "High",
      "dataPartitioning": "Segmented",
      "isERP": false,
      "capabilityType": [
        "sms",
        "email"
      ],
      "hosting": "cloud"
    }
  ],
  "edges": [
    {
      "source": "bwdc-sys-capita-waste",
      "target": "bwdc-fn-waste",
      "relationship": "REALIZES"
    },
    {
      "source": "bwdc-sys-nec-revs",
      "target": "bwdc-fn-benefits",
      "relationship": "REALIZES"
    },
    {
      "source": "bwdc-sys-capita-plan",
      "target": "bwdc-fn-planning",
      "relationship": "REALIZES"
    },
    {
      "source": "bwdc-sys-capita-housing",
      "target": "bwdc-fn-housing",
      "relationship": "REALIZES"
    },
    {
      "source": "bwdc-sys-nec-eh",
      "target": "bwdc-fn-envhealth",
      "relationship": "REALIZES"
    },
    {
      "source": "bwdc-sys-capita-fin",
      "target": "bwdc-fn-finance",
      "relationship": "REALIZES"
    },
    {
      "source": "bwdc-sys-nec-hr",
      "target": "bwdc-fn-hr",
      "relationship": "REALIZES"
    },
    {
      "source": "bwdc-sys-inhouse-crm",
      "target": "bwdc-fn-crm",
      "relationship": "REALIZES"
    },
    {
      "source": "bwdc-sys-inhouse-crm",
      "target": "bwdc-sys-govuk-notify",
      "relationship": "CONSUMES_CAPABILITY",
      "capabilities": [
        "email"
      ]
    },
    {
      "source": "bwdc-sys-nec-revs",
      "target": "bwdc-sys-govuk-notify",
      "relationship": "CONSUMES_CAPABILITY",
      "capabilities": [
        "email"
      ]
    }
  ]
}