{
  "councilName": "Hartfordshire County Council",
  "councilMetadata": {
    "tier": "county",
    "financialDistress": false
  },
  "nodes": [
    { "id": "hcc-fn-adultsocial", "label": "Adult Social Care", "type": "Function", "lgaFunctionId": "148" },
    { "id": "hcc-fn-childrens", "label": "Children's Services", "type": "Function", "lgaFunctionId": "152" },
    { "id": "hcc-fn-highways", "label": "Highways Management", "type": "Function", "lgaFunctionId": "109" },
    { "id": "hcc-fn-libraries", "label": "Library Services", "type": "Function", "lgaFunctionId": "76" },
    { "id": "hcc-fn-crm", "label": "Customer Relationship Management", "type": "Function", "lgaFunctionId": "43" },
    { "id": "hcc-fn-finance", "label": "Finance and Accounting", "type": "Function", "lgaFunctionId": "116" },
    { "id": "hcc-fn-hr", "label": "Human Resources", "type": "Function", "lgaFunctionId": "119" },
    {
      "id": "hcc-sys-oracle-erp",
      "label": "Oracle E-Business Suite",
      "type": "ITSystem",
      "owner": "Hartfordshire County Council",
      "users": 8000,
      "vendor": "Oracle",
      "supportModel": "vendor-supported",
      "cost": "£2.4m/yr",
      "annualCost": 2400000,
      "endYear": 2029,
      "endMonth": 3,
      "noticePeriod": 12,
      "portability": "Low",
      "dataPartitioning": "Monolithic",
      "isCloud": false,
      "isERP": true,
      "capabilityType": ["payments", "workflow"]
    },
    {
      "id": "hcc-sys-liquidlogic-las",
      "label": "Liquidlogic LAS",
      "type": "ITSystem",
      "owner": "Hartfordshire County Council",
      "users": 3500,
      "vendor": "System C",
      "supportModel": "vendor-supported",
      "cost": "£950k/yr",
      "annualCost": 950000,
      "endYear": 2028,
      "endMonth": 9,
      "noticePeriod": 9,
      "portability": "Medium",
      "dataPartitioning": "Segmented",
      "isCloud": true,
      "isERP": false
    },
    {
      "id": "hcc-sys-liquidlogic-ehm",
      "label": "Liquidlogic EHM",
      "type": "ITSystem",
      "owner": "Hartfordshire County Council",
      "users": 2800,
      "vendor": "System C",
      "supportModel": "vendor-supported",
      "cost": "£800k/yr",
      "annualCost": 800000,
      "endYear": 2028,
      "endMonth": 9,
      "noticePeriod": 9,
      "portability": "Medium",
      "dataPartitioning": "Segmented",
      "isCloud": true,
      "isERP": false
    },
    {
      "id": "hcc-sys-confirm",
      "label": "Confirm Highways",
      "type": "ITSystem",
      "owner": "Hartfordshire County Council",
      "users": 400,
      "vendor": "Brightly",
      "supportModel": "vendor-supported",
      "cost": "£250k/yr",
      "annualCost": 250000,
      "endYear": 2027,
      "endMonth": 6,
      "noticePeriod": 6,
      "portability": "High",
      "dataPartitioning": "Segmented",
      "isCloud": true,
      "isERP": false
    },
    {
      "id": "hcc-sys-symphony",
      "label": "Symphony ILS",
      "type": "ITSystem",
      "owner": "Hartfordshire County Council",
      "users": 150,
      "vendor": "SirsiDynix",
      "supportModel": "vendor-supported",
      "cost": "£180k/yr",
      "annualCost": 180000,
      "endYear": 2030,
      "endMonth": 3,
      "noticePeriod": 6,
      "portability": "Medium",
      "dataPartitioning": "Segmented",
      "isCloud": false,
      "isERP": false
    },
    {
      "id": "hcc-sys-dynamics",
      "label": "Microsoft Dynamics 365",
      "type": "ITSystem",
      "owner": "Hartfordshire County Council",
      "users": 1200,
      "vendor": "Microsoft",
      "supportModel": "vendor-supported",
      "cost": "£450k/yr",
      "annualCost": 450000,
      "endYear": 2028,
      "endMonth": 3,
      "noticePeriod": 3,
      "portability": "High",
      "dataPartitioning": "Segmented",
      "isCloud": true,
      "isERP": false
    },
    {
      "id": "hcc-sys-capita-pay360",
      "label": "Capita Pay360",
      "type": "ITSystem",
      "owner": "Hartfordshire County Council",
      "users": 200,
      "vendor": "Capita",
      "supportModel": "vendor-supported",
      "cost": "£60k/yr",
      "annualCost": 60000,
      "endYear": 2029,
      "endMonth": 6,
      "noticePeriod": 6,
      "portability": "High",
      "dataPartitioning": "Segmented",
      "isCloud": true,
      "isERP": false,
      "capabilityType": ["payments"]
    },
    {
      "id": "hcc-sys-govuk-notify",
      "label": "GOV.UK Notify",
      "type": "ITSystem",
      "owner": "Hartfordshire County Council",
      "users": 150,
      "vendor": "GDS",
      "supportModel": "vendor-supported",
      "cost": "£5k/yr",
      "annualCost": 5000,
      "endYear": 2030,
      "endMonth": 3,
      "noticePeriod": 1,
      "portability": "High",
      "dataPartitioning": "Segmented",
      "isCloud": true,
      "isERP": false,
      "capabilityType": ["sms", "email"]
    }
  ],
  "edges": [
    { "source": "hcc-sys-liquidlogic-las", "target": "hcc-fn-adultsocial", "relationship": "REALIZES" },
    { "source": "hcc-sys-liquidlogic-ehm", "target": "hcc-fn-childrens", "relationship": "REALIZES" },
    { "source": "hcc-sys-confirm", "target": "hcc-fn-highways", "relationship": "REALIZES" },
    { "source": "hcc-sys-symphony", "target": "hcc-fn-libraries", "relationship": "REALIZES" },
    { "source": "hcc-sys-dynamics", "target": "hcc-fn-crm", "relationship": "REALIZES" },
    { "source": "hcc-sys-oracle-erp", "target": "hcc-fn-finance", "relationship": "REALIZES" },
    { "source": "hcc-sys-oracle-erp", "target": "hcc-fn-hr", "relationship": "REALIZES" },
    { "source": "hcc-sys-liquidlogic-las", "target": "hcc-sys-govuk-notify", "relationship": "CONSUMES_CAPABILITY", "capabilities": ["sms", "email"] },
    { "source": "hcc-sys-liquidlogic-ehm", "target": "hcc-sys-govuk-notify", "relationship": "CONSUMES_CAPABILITY", "capabilities": ["sms", "email"] },
    { "source": "hcc-sys-confirm", "target": "hcc-sys-govuk-notify", "relationship": "CONSUMES_CAPABILITY", "capabilities": ["email"] },
    { "source": "hcc-sys-dynamics", "target": "hcc-sys-capita-pay360", "relationship": "CONSUMES_CAPABILITY", "capabilities": ["payments"] },
    { "source": "hcc-sys-dynamics", "target": "hcc-sys-govuk-notify", "relationship": "CONSUMES_CAPABILITY", "capabilities": ["email"] }
  ]
}
